{
  "$schema": "./schemas/tracking-plan.schema.json",
  "plan_name": "Arclight measurement plan",
  "plan_version": "2026.2.0",
  "updated_at": "2026-09-09",
  "description": "The machine-readable source of truth. Prose documentation is generated from this file; TypeScript types are generated from this file; CI validates against this file. Nothing is authoritative except this file.",
  "conventions": {
    "event_name_pattern": "^[a-z][a-z0-9_]{2,39}$",
    "max_event_name_length": 40,
    "property_name_pattern": "^[a-z][a-z0-9_]{1,39}$",
    "max_property_name_length": 40,
    "enum_value_pattern": "^[a-z0-9][a-z0-9_]{0,60}$",
    "max_properties_per_event": 12,
    "soft_max_properties_per_event": 8,
    "reserved_prefixes": [
      "ga_",
      "google_",
      "firebase_",
      "gtm_",
      "dl_",
      "_"
    ],
    "reserved_event_names": [
      "session_start",
      "first_visit",
      "first_open",
      "user_engagement",
      "app_remove",
      "ad_click",
      "ad_impression"
    ],
    "forbidden_name_patterns": [
      {
        "pattern": "_v[0-9]+$",
        "reason": "Version suffixes in names. Mint a new semantic name instead."
      },
      {
        "pattern": "__",
        "reason": "Double underscore."
      },
      {
        "pattern": "^(test|tmp|temp|debug|asdf|xxx)_",
        "reason": "Test artifact in a production plan."
      },
      {
        "pattern": "(button|link|modal|popup|div)",
        "reason": "UI element in an event name. Track the transition, not the widget."
      }
    ],
    "approved_verbs": [
      "created",
      "added",
      "removed",
      "deleted",
      "archived",
      "updated",
      "renamed",
      "viewed",
      "opened",
      "started",
      "completed",
      "abandoned",
      "cancelled",
      "failed",
      "submitted",
      "accepted",
      "declined",
      "shared",
      "invited",
      "upgraded",
      "downgraded",
      "connected",
      "disconnected",
      "searched",
      "exported",
      "imported",
      "identified",
      "reached",
      "blocked",
      "hit",
      "progressed",
      "engaged",
      "performed",
      "captured",
      "requested",
      "used",
      "adopted",
      "succeeded",
      "expired",
      "reactivated",
      "extended",
      "set",
      "returned",
      "thrown",
      "changed",
      "closed",
      "configured",
      "sent",
      "clicked"
    ],
    "name_exceptions": [
      "page_view",
      "purchase",
      "refund",
      "add_to_cart",
      "remove_from_cart",
      "view_cart",
      "begin_checkout",
      "add_shipping_info",
      "add_payment_info",
      "view_item",
      "view_item_list",
      "select_item",
      "view_promotion",
      "select_promotion",
      "add_to_wishlist",
      "generate_lead"
    ],
    "name_exceptions_reason": "GA4 recommended ecommerce and lead event names. Mapping to the platform's own vocabulary preserves its built-in reporting; inventing a parallel custom event fragments it. Exempt from the verb rule only.",
    "enum_value_pattern_note": "Lowercase snake_case. A leading digit is permitted only for banded ranges such as 1_10 or 5k_25k."
  },
  "platform_limits": {
    "ga4": {
      "verified_on": "2026-09",
      "note": "Google truncates rather than errors. Nothing in the UI reports a breach. This is why the limits are enforced here.",
      "event_name_max_chars": 40,
      "parameters_per_event": 25,
      "parameter_name_max_chars": 40,
      "parameter_value_max_chars": 100,
      "user_properties_max": 25,
      "user_property_name_max_chars": 24,
      "user_property_value_max_chars": 36,
      "event_scoped_dimensions": 50,
      "event_scoped_metrics": 50,
      "user_scoped_dimensions": 25,
      "item_scoped_dimensions": 10
    }
  },
  "budgets": {
    "event_scoped_dimensions": {
      "cap": 50,
      "budget": 30
    },
    "user_scoped_dimensions": {
      "cap": 25,
      "budget": 15
    },
    "free_text_properties": 0,
    "unbounded_non_id_properties_per_event": 0,
    "unbounded_non_id_note": "Identifier properties ending in _id are explicit join keys and are exempt. Anything else unbounded is free text in disguise."
  },
  "tiers": {
    "0": {
      "label": "Revenue / contractual",
      "source": "server",
      "monitoring": "hourly_freshness_paged_anomaly",
      "approvals": 2,
      "reconciliation": "monthly"
    },
    "1": {
      "label": "Activation loop",
      "source": "server_or_hardened_client",
      "monitoring": "daily_freshness_alert",
      "approvals": 1,
      "reconciliation": "quarterly"
    },
    "2": {
      "label": "Feature usage / diagnostics",
      "source": "any",
      "monitoring": "weekly_dashboard",
      "approvals": 1,
      "reconciliation": "none"
    },
    "3": {
      "label": "Experimental",
      "source": "any",
      "monitoring": "none",
      "approvals": 1,
      "reconciliation": "none",
      "default_ttl_days": 90
    }
  },
  "enums": {
    "plan_tier": [
      "free",
      "starter",
      "growth",
      "enterprise"
    ],
    "billing_interval": [
      "monthly",
      "annual"
    ],
    "signup_method": [
      "email",
      "google",
      "microsoft",
      "saml",
      "invite",
      "api"
    ],
    "creation_path": [
      "self_serve",
      "sales_provisioned",
      "partner",
      "migration"
    ],
    "creation_method": [
      "blank",
      "template",
      "import",
      "duplicate",
      "api",
      "manual",
      "automation"
    ],
    "payment_method": [
      "card",
      "sepa_debit",
      "bank_transfer",
      "invoice",
      "other"
    ],
    "payment_failure_reason": [
      "insufficient_funds",
      "card_expired",
      "card_declined",
      "3ds_failed",
      "sca_required",
      "processor_error",
      "fraud_suspected"
    ],
    "cancellation_reason": [
      "too_expensive",
      "missing_features",
      "switched_competitor",
      "no_longer_needed",
      "poor_experience",
      "company_closed",
      "not_specified"
    ],
    "cancellation_type": [
      "voluntary",
      "involuntary",
      "sales_initiated"
    ],
    "change_trigger": [
      "self_serve",
      "sales",
      "usage_threshold",
      "seat_true_up"
    ],
    "member_role": [
      "owner",
      "admin",
      "editor",
      "commenter",
      "viewer",
      "billing"
    ],
    "change_source": [
      "invite",
      "sso_provisioning",
      "admin_action",
      "scim"
    ],
    "invite_surface": [
      "onboarding",
      "settings",
      "share_modal",
      "empty_state",
      "api"
    ],
    "integration_category": [
      "crm",
      "messaging",
      "storage",
      "identity",
      "billing",
      "automation"
    ],
    "integration_slug": [
      "hubspot",
      "salesforce",
      "pipedrive",
      "slack",
      "teams",
      "gmail",
      "outlook",
      "google_drive",
      "notion",
      "zapier",
      "okta",
      "stripe"
    ],
    "auth_method": [
      "oauth2",
      "api_key",
      "webhook",
      "saml"
    ],
    "disconnect_reason": [
      "user_action",
      "auth_expired",
      "permission_revoked",
      "error_threshold",
      "account_deleted"
    ],
    "flow_id": [
      "initial_setup",
      "workspace_setup",
      "integration_setup",
      "team_invite",
      "feature_intro"
    ],
    "step_id": [
      "create_pipeline",
      "invite_team",
      "connect_crm",
      "import_deals",
      "set_goals",
      "review_summary"
    ],
    "step_outcome": [
      "completed",
      "skipped",
      "failed"
    ],
    "entry_point": [
      "post_signup",
      "first_login",
      "empty_state",
      "nav_prompt",
      "email_link",
      "resumed"
    ],
    "activation_path": [
      "guided",
      "self_directed",
      "sales_assisted",
      "invited_to_existing"
    ],
    "deal_stage": [
      "new",
      "qualified",
      "discovery",
      "proposal",
      "negotiation",
      "closed_won",
      "closed_lost",
      "on_hold"
    ],
    "deal_value_band": [
      "under_1k",
      "1k_5k",
      "5k_25k",
      "25k_100k",
      "over_100k"
    ],
    "close_outcome": [
      "won",
      "lost",
      "no_decision"
    ],
    "export_format": [
      "csv",
      "xlsx",
      "pdf",
      "json",
      "api"
    ],
    "export_surface": [
      "dashboard",
      "report",
      "item_detail",
      "settings",
      "api"
    ],
    "status": [
      "success",
      "partial",
      "failed",
      "cancelled"
    ],
    "page_type": [
      "home",
      "pricing",
      "product",
      "blog",
      "docs",
      "case_study",
      "comparison",
      "legal",
      "careers",
      "app",
      "auth",
      "other"
    ],
    "form_type": [
      "demo_request",
      "contact",
      "content_download",
      "newsletter",
      "webinar",
      "pricing_enquiry",
      "trial_request"
    ],
    "form_surface": [
      "landing_page",
      "inline_content",
      "modal",
      "footer",
      "chat",
      "sidebar"
    ],
    "cta_location": [
      "hero",
      "nav",
      "inline",
      "sticky",
      "footer",
      "modal",
      "pricing_table"
    ],
    "email_domain_type": [
      "business",
      "freemail",
      "edu",
      "disposable"
    ],
    "company_size_band": [
      "1_10",
      "11_50",
      "51_200",
      "201_1000",
      "1000_plus",
      "unknown"
    ],
    "gate_id": [
      "pipeline_automation",
      "advanced_reporting",
      "api_access",
      "sso",
      "audit_log",
      "custom_fields",
      "bulk_import",
      "seat_limit"
    ],
    "usage_depth": [
      "viewed",
      "used",
      "configured",
      "automated"
    ],
    "feature_category": [
      "authoring",
      "automation",
      "analytics",
      "collaboration",
      "admin",
      "integration",
      "ai"
    ],
    "error_class": [
      "client",
      "server",